Title,creator,Tags,Number_of_Copies,Description
Negotiating 101,Peter Sander,"business, communication, leadership &amp; management",1,"A quick-and-easy guide to core business and career concepts--no MBA required! The ability to negotiate a deal. Confidence to oversee staff. Complete, accurate monitoring of expenses. In today's business world, these are must-have skills. But all too often, comprehensive business books turn the important details of best practices into tedious reading that would put even a CEO to sleep. From hiring..."
Never Never,"Colleen Hoover, Tarryn Fisher","fiction, romance",1,"Forgetting is terrifying. Remembering is worse... Charlie Wynwood and Silas Nash have been best friends since they could walk. They've been in love since the age of fourteen. But as of this morning... they are complete strangers. Their first kiss, their first fight, the moment they fell in love... every memory has vanished. Now Charlie and Silas must work together to uncover the truth about what..."
New One Minute Manager,"Ken Blanchard, Spencer, M.D. Johnson",self-help,6,"A new edition based on the timeless business classic—updated to help today’s readers succeed more quickly in a rapidly changing world.For decades, The One Minute Manager® has helped millions achieve more successful professional and personal lives. While the principles it lays out are timeless, our world has changed drastically since the book’s publication. The exponential rise of technology..."
Next Person You Meet in Heaven,Mitch Albom,fiction,1,"In this enchanting sequel to the number one bestseller The Five People You Meet in Heaven, Mitch Albom tells the story of Eddie's heavenly reunion with Annie--the little girl he saved on earth--in an unforgettable novel of how our lives and losses intersect. Fifteen years ago, in Mitch Albom's beloved novel, The Five People You Meet in Heaven, the world fell in love with Eddie, a grizzled war..."
No Excuses!: The Power of Self-Discipline,Brian Tracy,"self-help, business",2,"Most people think success comes from good luck or enormous talent, but many successful people achieve their accomplishments in a simpler way: through self-discipline. No Excuses! shows you how you can achieve success in all three major areas of your life, including your personal goals, business and money goals, and overall happiness.Each of the 21 chapters in this book shows you how to be more..."
Norwegian Wood,Haruki Murakami,"fiction, coming-of-age",1,"This stunning and elegiac novel by the author of the internationally acclaimed Wind-Up Bird Chronicle has sold over 4 million copies in Japan and is now available to American audiences for the first time.  It is sure to be a literary event.Toru, a quiet and preternaturally serious young college student in Tokyo, is devoted to Naoko, a beautiful and introspective young woman, but their mutual..."
Nosotros Means Us,Paloma Valdivia,"fiction, animals, latin america",1,"A moving bilingual ode to the unshakeable bond between a parent and child in the tradition of Runaway Bunny and The Wonderful Things You Will Be. If I were a sheep, you would be a lamb. If I were a bear, you would be a cub. As a mother holds her toddler, they muse over the way their love would translate if they were different animals. But no matter how they change, they will always be ""us."" This..."
November 9 (Nine),Colleen Hoover,"romance, fiction",1,"Fallon meets Ben, an aspiring novelist, the day before her scheduled cross-country move. Their untimely attraction leads them to spend Fallon's last day in L.A. together, and her eventful life becomes the creative inspiration Ben has always sought for his novel. Over time and amidst the various relationships and tribulations of their own separate lives, they continue to meet on the same date every..."
On the Road: The Original Scroll (Penguin Classics Deluxe Edition),Jack Kerouac,fiction,1,"The legendary 1951 scroll draft of On the Road, published as Kerouac originally composed itIN THREE WEEKS in April of 1951, Jack Kerouac wrote his first full draft of On the Road—typed as a single-spaced paragraph on eight long sheets of tracing paper, which he later taped together to form a 120-foot scroll. A major literary event when it was published in Viking hardcover in 2007, this is..."
"One Piece, Vol. 106",Eiichiro Oda,"fiction, fantasy, anime",1,"Join Monkey D. Luffy and his swashbuckling crew in their search for the ultimate treasure, One Piece! As a child, Monkey D. Luffy dreamed of becoming King of the Pirates. But his life changed when he accidentally gained the power to stretch like rubber...at the cost of never being able to swim again! Years later, Luffy sets off in search of the One Piece, said to be the greatest treasure in the..."
One Piece: East Blue 1-2-3,Eiichiro Oda,"manga, adventure",2,"High jinx on the high seas! Buy three volumes of One Piece for the price of two!R to L (Japanese Style). High jinx on the high seas! Buy three volumes of One Piece for the price of two! As a child, Monkey D. Luffy dreamed of becoming the King of the Pirates. But his life changed when he accidentally gained the power to stretch like rubber…at the cost of never being able to swim again!..."
Outliers: The Story of Success,Malcolm Gladwell,"business, startups",1,"In this stunning new book, Malcolm Gladwell takes us on an intellectual journey through the world of ""outliers""--the best and the brightest, the most famous and the most successful. He asks the question: what makes high-achievers different? His answer is that we pay too much attention to what successful people are like, and too little attention to where they are from: that is, their culture, their..."
Outliers: The Story of Success,Malcolm Gladwell,"business, startups",1,"In this stunning new book, Malcolm Gladwell takes us on an intellectual journey through the world of ""outliers""--the best and the brightest, the most famous and the most successful. He asks the question: what makes high-achievers different? His answer is that we pay too much attention to what successful people are like, and too little attention to where they are from: that is, their culture, their..."
Outsider,Stephen King,"novel, crime, fiction, thriller, horror, mystery",1,"Soon to be an HBO limited series starring Ben Mendelsohn! Evil has many faces…maybe even yours in this #1 New York Times bestseller from master storyteller Stephen King. An eleven-year-old boy’s violated corpse is discovered in a town park. Eyewitnesses and fingerprints point unmistakably to one of Flint City’s most popular citizens—Terry Maitland, Little League coach, English teacher,..."
Patriot,Stephen Molstad,"fiction, war, history",1,"In Tyranny's Fire A Hero Is Forged      In Britain's American colonies, the cry goes out for freedom as the air from Lexington to the Carolinas burns hot with powder smoke and cannon fire.  But Benjamin Martin has had his fill of war.  A veteran of the fierce French and Indian conflict, he has renounced fighting forever, retiring to his South Carolina farm to raise his motherless children in peace..."
Percy Jackson's Greek Gods,Rick Riordan,"fantasy, fiction, short story, greek mythology",1,"A publisher in New York asked me to write down what I know about the Greek gods, and I was like, Can we do this anonymously? Because I don't need the Olympians mad at me again. But if it helps you to know your Greek gods, and survive an encounter with them if they ever show up in your face, then I guess writing all this down will be my good deed for the week. So begins Percy Jackson's Greek Gods,..."
Personal MBA 10th Anniversary Edition,Josh Kaufman,"business, entrepreneurship",1,"Many people assume they need to attend business school to learn how to build a successful business or advance in their career. That's not true. The vast majority of modern business practice requires little more than common sense, simple arithmetic, and knowledge of a few very important ideas and principles. The Personal MBA 10th Anniversary Edition provides a clear overview of the essentials of..."
Pied Piper of Hamelin,Little Gestalten,fairy tale,1,"Through a bold palette, the legend of the Pied Piper is artfully enlivened. The Pied Piper of Hamelin is set in the north of Germany in the year 1283. It is nearly Christmas and the townspeople are ready to celebrate when a rodent infestation interrupts their everyday lives. The mayor announces a seemingly straightforward proposition: rid the town of the rats and be given one thousand gold coins...."
Planet Ape,"Desmond Morris, Steve Parker","nature, life sciences, zoology, animals",1,"""Planet Ape"" brings you face to face with your closest living relatives, the Great Apes. Gorillas, chimpanzees, bonobos and orang-utans are only a hair's breadth away from us in evolutionary terms; our DNA differs by just a few per cent. These fascinating creatures hold up a mirror to humanity, giving us insights into our past, our present, and perhaps even our future - the environmental pressures..."
Point of Retreat: A Novel,Colleen Hoover,"romance, fiction",1,"Sometimes two people have to fall apart to realize just how much they belong together. Colleen Hoover entranced readers everywhere with her bestselling novel Slammed, the book that introduced Layken and Will, a young couple whose love overcame devastating hardships to emerge stronger and more resilient than before. Now, as Layken and Will’s emotion-packed story continues, a stunning and..."
Pokémon Visual Companion Third Edition,DK,kids,1,"The world of Pokémon awaits you! Learn all about your favorite Pokémon in this fact-packed guide to the animated series. Discover every region from Kanto to Alola, including the people and Pokémon who live there. Trace Ash's journey and get to know his friends and travel companions. See epic battles and meet Legendary and Mythical Pokémon."
Poor Charlie's Almanack,Charles T. Munger,"business, inspiration, self-help",2,"From the legendary vice-chairman of Berkshire Hathaway, lessons in investment strategy, philanthropy, and living a rational and ethical life. ""Spend each day trying to be a little wiser than you were when you woke up,"" Charles T. Munger advises in Poor Charlie's Almanack. Originally published in 2005, this compendium of eleven talks delivered by the legendary Berkshire Hathaway vice-chairman..."
Power of Habit: Why We Do What We Do in Life and Business,Charles Duhigg,"business, personal growth",1,"OVER 60 WEEKS ON THE NEW YORK TIMES BESTSELLER LISTWith a new Afterword by the author In The Power of Habit, Pulitzer Prize–winning business reporter Charles Duhigg takes us to the thrilling edge of scientific discoveries that explain why habits exist and how they can be changed. Distilling vast amounts of information into engrossing narratives that take us from the boardrooms of..."
Power of Significance: How Purpose Changes Your Life,John C. Maxwell,"self-help, business, economics",1,"John C. Maxwell, #1 New York Times bestselling author, shows you how to achieve a life of purpose and meaning in this compact new book derived from his previous title, Intentional Living. We all have a longing to be significant, to make a contribution, to  be a part of something noble and purposeful. But know this: you don't  have to be a certain age, have a lot of money, or be powerful or famous..."
Practice of System and Network Administration: Volume 1: DevOps and other Best Practices for Enterprise IT (3rd Edition),"Thomas A. Limoncelli, Christina J. Hogan, Strata R. Chalup","technology, business",3,"With 28 new chapters, the third edition of  The Practice of System and Network Administration  innovates yet again! Revised with thousands of updates and clarifications based on reader feedback, this new edition also incorporates DevOps strategies even for non-DevOps environments.    Whether you use Linux, Unix, or Windows, this new edition describes the essential practices previously handed..."
Pretty Ugly,"David Sedaris, Ian Falconer (Illustrator)","fiction, children",1,"A hilariously quirky monster tale about appreciating beauty--in all its weird and wonderful forms!-- by the creator of the iconic Olivia books and bestselling humorist David Sedaris. Sedaris and Falconer make a spectacular splash with this tale of a monster turned ugly--stuck with a human face! In this beautifully gross picture book, Anna Van Ogre's lovely monster face turns into that of a..."
Prince (Clydesdale Classics),Niccolò Machiavelli,"philosophy, political",2,"Packaged in handsome, affordable trade editions, Clydesdale Classics is a new series of essential works. From the musings of intellectuals such as Thomas Paine in Common Sense to the striking personal narrative of Harriet Jacobs in Incidents in the Life of a Slave Girl, this new series is a comprehensive collection of our intellectual history through the words of the exceptional few. Widely..."
Probe (Star Trek),Margaret Wander Bonanno,fiction,1,"Star Trek quarter century. Now Bonanno presents Star Trek IV--the most popular Star Trek movie of them all. Kirk, Spock and their shipmates find themselves headed for a final confrontation not only mysterious probe, but with the Romulan Empire.--Science Fiction)"
Promised Land,Barack Obama,"biography, new york time best seller, politics",1,
"Psych 101: Psychology Facts, Basics, Statistics, Tests, and More!",Paul Kleinman,personal growth,1,"A hands-on approach to exploring the human mindToo often, textbooks turn the noteworthy theories, principles, and experiments of psychology into tedious discourse that even Freud would want to repress. Psych 101 cuts out the boring details and statistics, and instead, gives you a lesson in psychology that keeps you engaged - and your synapses firing.From personality quizzes and the Rorschach Blot..."
"Psych Experiments: From Pavlov's dogs to Rorschach's inkblots, put psychology's most fascinating studies to the test",Michael A. Britt Ph.D,"psychology, history",1,"Psychology's most famous theories--played out in real life! Forget the labs and lecture halls. You can conduct your very own psych experiments at home! Famous psychological experiments--from Freud's ego to the Skinner box--have changed the way science views human behavior. But how do these tests really work? In Psych Experiments, you'll learn how to test out these theories and experiments for..."
Purple Cane Road: A Novel (Dave Robicheaux Mysteries),James Lee Burke,fiction,1,"Dave Robicheaux has spent his life confronting the age-old adage that the sins of the father pass onto the son. But what has his mother's legacy left him? Dead to him since youth, Mae Guillory has been shuttered away in the deep recesses of Dave's mind. He's lived with the fact that he would never really know what happened to the woman who left him to the devices of his whiskey-..."
Purpose Driven Life: What on Earth am I Here For?,Rick Warren,"non-fiction, Christian literature",1,
Radical Candor,Kim Scott,"non-fiction, business, economics",1,"""Informational and clear, [Radical Candor] is necessary reading for anyone who's having trouble coming to terms with an underperforming workforce."" --Publishers Weekly"
Raving Fans,"Ken Blanchard, Sheldon Bowles","self-help, business",2,Slight wear on cover.
Reasons to Stay Alive,Matt Haig,"nonfiction, self-help, pscyhology",1,"One of Entertainment Weekly's 25 most anticipated books of 2016—Matt Haig’s accessible and life-affirming memoir of his struggle with depression, and how his triumph over the illness taught him to live   Like nearly one in five people, Matt Haig suffers from depression. Reasons to Stay Alive is Matt’s inspiring account of how, minute by minute and day by day, he overcame the disease with..."
"Red, White & Royal Blue",Casey McQuiston,"fiction, novel, romance",1,"A PopSugar Must-Read Book of 2019! What happens when America's First Son falls in love with the Prince of Wales? When his mother became President, Alex Claremont-Diaz was promptly cast as the American equivalent of a young royal. Handsome, charismatic, genius—his image is pure millennial-marketing gold for the White House. There's only one problem: Alex has a beef with the actual prince, Henry,..."
Reflex (Jumper),Steven Gould,fiction,1,"Davy has always been alone.  He believes that he's the only person in the world who can teleport.   But what if he isn't?A mysterious group of people has taken Davy captive.  They don't want to hire him, and they don't have any hope of appealing to him to help them.   What they want is to own him.  They want to use his abilities for their own purposes, whether Davy agrees to it..."
Regretting You,Colleen Hoover,"contemporary, romance, fiction",1,"From #1 New York Times bestselling author of It Ends with Us comes a poignant novel about family, first love, grief, and betrayal that will touch the hearts of both mothers and daughters. Morgan Grant and her sixteen-year-old daughter, Clara, would like nothing more than to be nothing alike. Morgan is determined to prevent her daughter from making the same mistakes she did. By getting pregnant and..."
Remember Me,Christopher Pike,fiction,1,"In this harrowing thriller from bestselling author Christopher Pike, a teen girl must solve the mystery of her own murder before the killer strikes again. After a night spent out with friends, Shari Cooper wakes up in her bed not sure how she got home. And things only get stranger when her family acts like she's not even there. Nothing Shari says gets a response and nothing she does can get..."
Reminders of Him,Colleen Hoover,"fiction, romance, contemporary",1,"A troubled young mother yearns for a shot at redemption in this heartbreaking yet hopeful story from #1 New York Times bestselling author Colleen Hoover. After serving five years in prison for a tragic mistake, Kenna Rowan returns to the town where it all went wrong, hoping to reunite with her four-year-old daughter. But the bridges Kenna burned are proving impossible to rebuild. Everyone in her..."
Return of Sherlock Holmes (Collins Classics),Sir Arthur Conan Doyle,fiction,1,"HarperCollins is proud to present its incredible range of best-loved, essential classics. Originally published in 1903-1904, The Return of Sherlock Holmes is the thirteen-story collection of one of the greatest-ever fictional detectives. Three years after the supposed death of Sherlock Holmes and his archenemy Professor Moriarty in the torrent of Reichenbach Falls, Holmes makes a disguised..."
Rewilding,"David A. Steen, Chiara Fedele (Illustrator), Neon Squid","nonfiction, animals, nature",1,"""A book worth returning to multiple times. A fascinating primer on the intricacies of ecosystems."" -- Kirkus, starred review Discover inspiring stories of wildlife brought back from the brink of extinction in this kids' nonfiction book about animals and the environment. Rewilding means returning animals or plants to places where they used to live. In this book, acclaimed conservation biologist and..."
Rich Dad Poor Dad: What the Rich Teach Their Kids About Money That the Poor and Middle Class Do Not!,Robert T. Kiyosaki,"self-help, business",3,"April 2017 marks 20 years since Robert Kiyosaki’s Rich Dad Poor Dad first made waves in the Personal Finance arena.It has since become the #1 Personal Finance book of all time... translated into dozens of languages and sold around the world.  Rich Dad Poor Dad is Robert's story of growing up with two dads  his real father and the father of his best friend, his rich dad  and the ways in which..."
Rich Dad's Cashflow Quadrant: Guide to Financial Freedom,Robert Kiyosaki,"business, finance",1,Book by Robert Kiyosaki
Richest Man in Babylon,George S. Clason,"business, self-help, personal development",2,"Beloved by millions, this timeless classic holds the key to all you desire and everything you wish to accomplish. This is the book that reveals the secret to personal wealth. The Success Secrets of the Ancients An Assured Road to Happiness and Prosperity Countless readers have been helped by the famous Babylonian parables,” hailed as the greatest of all inspirational works on the subject of..."
Ripley's Believe It or Not! 2025,Ripley,"reference, encyclopedia",1,Ripley's Believe It or Not! is guaranteed to amaze and entertain children and adults alike with its unique blend of weird but true stories and jaw-dropping facts gathered from all over the world. This year... Marvel at the ice caves of Alaska. Find out what very unusual food Icelanders eat at their traditional mid-winter feast. Discover why Lucas the penguin has to wear rubber boots. Hear about...
Sad Girls,Lang Leav,"fiction, coming of age",1,"""Your first love isn't the first person you give your heart to--it's the first one who breaks it."" Sad Girls is the much anticipated debut novel from international best-selling author Lang Leav. A beautifully written and emotionally charged coming of age story, where young love, dark secrets, and tragedy collide. School is almost out for Audrey, but the panic attacks are just beginning. Because..."
Sales 101,Wendy Connick,"self-help, business, economics",1,"Learn the ins and outs of sales techniques with this comprehensive and accessible guide that is the crash course in how to sell anything. Sometimes, it seems like learning a new skill is impossible. But whether you are interested in pursuing a full-times sales career, want to make extra money with sales as a side hustle, or are just looking to turn your hobby into a business, everyone can benefit..."
"Samurai Swords - A Collector's Guide: A Comprehensive Introduction to History, Collecting and Preservation - of the Japanese Sword",Clive Sinclaire,"history, japanese",1,"Japanese swords, particularly those wielded by famous samurai warriors, hold a continuing fascination for collectors of fine arts and historical military weapons. This book is designed to enhance one's appreciation for the wide variety of Japanese swords (as well as their related polearms), their manufacture and their preservation. A fascinating opening chapter explains how the elite Samurai class..."
Sapiens: A Brief History of Humankind,Yuval Noah Harari,"history, new york time best seller",1,"This is The Sunday Times Bestseller. Planet Earth is 4.5 billion years old. In just a fraction of that time, one species among countless others has conquered it. Us. We are the most advanced and most destructive animals ever to have lived. What makes us brilliant? What makes us deadly? What makes us Sapiens? In this bold and provocative book, Yuval Noah Harari explores who we are, how we got here..."
Sapiens: A Brief History of Humankind,Yuval Noah Harari,"history, new york time best seller",2,"100,000 years ago, at least six human species inhabited the earth. Today there is just one. Us. Homo sapiens. How did our species succeed in the battle for dominance? Why did our foraging ancestors come together to create cities and kingdoms? How did we come to believe in gods, nations and human rights; to trust money, books and laws; and to be enslaved by bureaucracy, timetables and consumerism?..."
Sapiens: a Graphic History,Yuval Noah Harari,history,1,"Instant National Bestseller The first volume of the graphic adaptation of Yuval Noah Harari's smash #1 New York Times and international bestseller recommended by President Barack Obama and Bill Gates, with gorgeous full-color illustrations and concise, easy to comprehend text for readers of all ages. One hundred thousand years ago, at least six different species of humans inhabited Earth. Yet..."
Scrum: The Art of Doing Twice the Work in Half the Time,Jeff Sutherland,"business, leadership & management",1,"We live in a world that is broken. For those who believe that there must be a more efficient way for people to get things done, here from Scrum pioneer Jeff Sutherland is a brilliantly discursive, thought-provoking book about the management process that is changing the way we live.   In the future, historians may look back on human progress and draw a sharp line designating “before..."
"Servant Leader: How to Build a Creative Team, Develop Great Morale, and Improve Bottom-Line Performance",James A. Autry,"self-help, business",2,"A Practical Guide to Using the Principles of Servant LeadershipLeadership is a calling. And servant leadership—the idea that managing with respect, honesty, love, and spirituality empowers employees—helps individuals answer that calling. Bestselling author and former Fortune 500 executive James A. Autry reveals the servant leader’s tools, a set of skills and ideals that will..."
Seven Husbands of Evelyn Hugo,Taylor Jenkins Reid,historical fiction,1,"“Riveting, heart-wrenching, and full of Old Hollywood glamour, The Seven Husbands of Evelyn Hugo is one of the most captivating reads of 2017.” –Buzzfeed “The epic adventures Evelyn creates over the course of a lifetime will leave every reader mesmerized. This wildly addictive journey of a reclusive Hollywood starlet and her tumultuous Tinseltown journey comes with unexpected twists and..."
Shanghai,Bradley Mayhew,travel,1,"As you immerse yourself in the untold stories and atmospheric photographs of old and new Shanghai, you will come to understand and appreciate this unique city. Let author Chen Danyan be your guide as she takes you on a fascinating tour: Visit an old Western-style house on the Huaihai Road in the former French Concession. Travel along the historic Bund and glimpse the old and new buildings on the..."
Shanghai,Bradley Mayhew,travel,1,"This guide offers information on places to stay, eat and party for travellers of all ages. It suggests itineraries for walking, bus and metro tours as well as information on where to find local treasures, designer clothes and Cultural Revolution pop trash."
