Title,creator,Tags,Number_of_Copies,Description
Infinite Game,Simon Sinek,"business, new york time best seller",2,"So many organizations and individuals are obsessed with winning. But how do you win a game that never really ends? There is no such thing, for example, as ""winning"" business. Simon Sinek's Start With Why and Leaders Eat Last have helped millions of readers see the hidden rules that govern our behavior. Now The Infinite Game challenges us to rethink our perspective with a deceptively simple..."
"Inside of a Dog: What Dogs See, Smell, and Know",Alexandra Horowitz,animals,1,"The answers will surprise and delight you as Alexandra Horowitz, a cognitive scientist, explains how dogs perceive their daily worlds, each other, and that other quirky animal, the human. Horowitz introduces the reader to dogs’ perceptual and cognitive abilities and then draws a picture of what it might be like to be a dog. What’s it like to be able to smell not just every bit of open..."
Intelligent Investor: The Definitive Book on Value Investing. A Book of Practical Counsel (Revised Edition),"Benjamin Graham, Jason Zweig","business, economics",1,"This classic text is annotated to update Graham's timeless wisdom for today's market conditions...  The greatest investment advisor of the twentieth century, Benjamin Graham, taught and inspired people worldwide. Graham's philosophy of ""value investing"" -- which shields investors from substantial error and teaches them to develop long-term strategies -- has made The..."
Invisible Woman,Erika Robuck,"fiction, thriller",1,"March 1944. Virginia Hall wasn't like the other young society women back home in Baltimore - she traded a safe life for adventure in Europe, and when her beloved second home is thrust into the dark days of war, she leaps in headfirst. Once she's recruited as an Allied spy, subverting the Nazis becomes her calling. But even the most cunning agent can be bested, and in wartime trusting the wrong..."
It Ends with Us,Colleen Hoover,"fiction, romance",4,"SOMETIMES THE ONE WHO LOVES YOU IS THE ONE WHO HURTS YOU THE MOST.  Lily hasn't always had it easy, but that's never stopped her from working hard for the life she wants. She's come a long way from the small town in Maine where she grew up - she graduated from college, moved to Boston, and started her own business. So when she feels a spark with a gorgeous neurosurgeon named Ryle Kincaid,..."
It Starts with Us,Colleen Hoover,"fiction, romance",1,"Before It Ends with Us, it started with Atlas. Colleen Hoover tells fan favourite Atlas' side of the story and shares what comes next in this long-anticipated sequel to the #1 Sunday Times bestseller It Ends with Us."
JEPH LOEB and TIM SALE: CAPTAIN AMERICA GALLERY EDITION,"Jeph Loeb, Tim Sale (Illustrator, Cover Design by)","comics, fiction, graphic novel",1,"The legendary creative team of writer Jeph Loeb and artist Tim Sale share a groundbreaking and uniquely colourful perspective on the early World War 2 adventures of Captain America! For Steve Rogers, the hardest thing about being a man out of time is being a man without a best friend. As Captain America comes to terms with his loss, he longs for the black and white moral simplicity of World War II..."
Just Kids,Patti Smith,"memoir, biography",1,"In Just Kids, Patti Smith’s first book of prose, the legendary American artist offers a never-before-seen glimpse of her remarkable relationship with photographer Robert Mapplethorpe in the epochal days of New York City and the Chelsea Hotel in the late sixties and seventies.  An honest and moving story of youth and friendship, Smith brings the same unique, lyrical quality to..."
Killing Kryptonite,John Bevere,"spirituality, religion",1,"You Can Destroy What Steals Your Strength. Just like Superman, who can leap over any hurdle and defeat every foe, followers of Christ have the supernatural ability to conquer the challenges we face. But the problem for both Superman and us is there¿s a kryptonite that steals our strength. Of course, both Superman and kryptonite are fictional. But spiritual kryptonite is not. This book offers..."
Kind Worth Killing: A Novel,Peter Swanson,"novel, mystery, suspense, fiction, thriller",1,"A devious tale of psychological suspense involving sex, deception, and an accidental encounter that leads to murder. Fans of Paula Hawkins’ The Girl on the Train will love this modern reimagining of Patricia Highsmith’s classic Strangers on a Train from the author of the acclaimed The Girl with a Clock for a Heart—which the Washington Post said “should be a contender for crime fiction’s..."
Landline: A Novel,Rainbow Rowell,"novel, romance, contemporary",1,"A New York Times Best Seller! Goodreads Choice Award Winner for Best Fiction of 2014! An Indie Next Pick!From New York Times bestselling author of Eleanor & Park and Fangirl, Rainbow Rowell, comes a hilarious, heart-wrenching take on love, marriage, and magic phones.Georgie McCool knows her marriage is in trouble. That it's been in trouble for a long time. She still loves her husband, Neal,..."
Laws of Human Nature,Robert Greene (author),"self-help, business",6,"100,000 years ago, at least six human species inhabited the earth. Today there is just one. Us. Homo sapiens. How did our species succeed in the battle for dominance? Why did our foraging ancestors come together to create cities and kingdoms? How did we come to believe in gods, nations and human rights; to trust money, books and laws; and to be enslaved by bureaucracy, timetables and consumerism?..."
Layla,Colleen Hoover,fiction,1,"""When Leeds meets Layla, he's convinced he'll spend the rest of his life with her--until an unexpected attack leaves Layla fighting for her life. After weeks in the hospital, Layla recovers physically, but the emotional and mental scarring has altered the woman Leeds fell in love with. In order to put their relationship back on track, Leeds whisks Layla away to the bed-and-breakfast where they..."
Leaders Make the Future: Ten New Leadership Skills for an Uncertain World (Bk Business),Bob Johansen,"business, leadership &amp; management",2,"We are in a time of disruptive leadership change. In a VUCA world—one characterized by volatility, uncertainty, complexity, and ambiguity—traditional leadership skills won’t be enough, noted futurist Bob Johansen argues. Drawing on the latest ten-year forecast from the Institute for the Future—the only futures think tank ever to outlive its forecasts—this powerful..."
Lean Startup,Eric Ries,"business, entrepreneurship, startups",1,"The Lean Startup: How Today's Entrepreneurs Use Continuous Innovation to Create Radically Successful Businesses is a book by Eric Ries describing his proposed lean startup strategy for startup companies. Ries developed the idea for the lean startup from his experiences as a startup advisor, employee, and founder.

The Lean Startup method teaches you how to drive a startup-how to steer, when to..."
"Lean Thinking: Banish Waste and Create Wealth in Your Corporation, Revised and Updated","James P. Womack, Daniel T. Jones","business, finance",2,The authors begin by summarizing the five inherent principles in any lean system: Correctly specify value so you are providing what the customer actually wants Identify the value stream for each product family and remove the wasted steps that don't create value but do create muda (waste) Make the remaining value-creating steps flow continuously to drastically shorten throughput timesAllow the...
Leaves of Grass (Bantam Classics),Walt Whitman,fiction,1,"One of the great innovative figures in American letters, Walt Whitman created a daringly new kind of poetry that became a major force in world literature. Leaves Of Grass is his one book.  First published in 1855 with only twelve poems, it was greeted by Ralph Waldo Emerson as ""the wonderful gift . . . the most extraordinary piece of wit and wisdom that America has yet contributed.&..."
Leaves of Grass (Collins Classics),Walt Whitman,fiction,1,"HarperCollins is proud to present its incredible range of best-loved, essential classics.I believe a leaf of grass is no less than the journey work of the stars…First published in 1855, and edited, revised and expanded over thirty years, ‘Leaves of Grass’ has become one of the most celebrated poetry collections in the history of American literature. A master of free verse, Walt Whitman..."
Leaves of Grass (Word Cloud Classics),Walt Whitman,fiction,1,"Leaves of Grass is a timeless collection of poems and essays penned by influential nineteenth-century writer Walt Whitman. This profound compilation explores topics such as nature, mysticism, mortality, transcendentalism, and democracy. Inspired by personal experiences and observations, Whitman spent almost four decades piecing together the complete work, sharing societal ideals and epiphanies..."
Let Us Dream,"Pope Francis, Austen Ivereigh","inspiration, mythology, personal growth",2,"In this uplifting and practical book, written in collaboration with his biographer, Austen Ivereigh, the preeminent spiritual leader explains why we must--and how we can--make the world safer, fairer, and healthier for all people now. In the COVID crisis, the beloved shepherd of over one billion Catholics saw the cruelty and inequity of our society exposed more vividly than ever before. He also..."
Light We Carry: Overcoming in Uncertain Times,Michelle Obama,"autobiography, self-help, memoir",1,"In an inspiring follow-up to her critically acclaimed, #1 bestselling memoir Becoming, former First Lady Michelle Obama shares practical wisdom and powerful strategies for staying hopeful and balanced in today’s highly uncertain world. There may be no tidy solutions or pithy answers to life’s big challenges, but Michelle Obama believes that we can all locate and lean on a set of tools to help..."
Lights Out,"Thomas Gryta, Ted Mann","economics, history",1,"How could General Electric--perhaps America's most iconic corporation--suffer such a swift and sudden fall from grace? This is the definitive history of General Electric's epic decline, as told by the two Wall Street Journal reporters who covered its fall. Since its founding in 1892, GE has been more than just a corporation. For generations, it was job security, a solidly safe investment, and an..."
Lily's Promise: Holding on to Hope Through Auschwitz and Beyond--A Story for All Generations,"Lily Ebert, Dov Forman","memoir, biography",1,
Lonely Planet Bangkok,"Joe Cummings, China Williams",travel,1,"This great guide to Bangkok features 24 colour maps of the city centre and surrounds, a dedicated chapter on the wonders of Thai cuisine, gives you the low-down on Bangkok's eclectic nightlife as well as easy-to-follow walking tours and fun daytrips."
Lonely Planet Beijing,Damian Harper,travel,1,"Comprehensive coverage of all the major sights in Beijing is included in this travel guide, as are detailed notes on hotels, restaurants and nightlife for various budgets. Practical information for the business and independent traveller is also featured throughout this text."
Lonely Planet China,Damian Harper,travel,1,"Thorough, time honored, and true, this guidebook covers it all, from showpiece Hong Kong to new frontiers only recently opened to travelers. Includes sections on cuisine, martial arts, religion, and more. 220 maps."
Lonely Planet Europe On A Shoestring,"Sarah Johnstone, China Williams, Reuben Acciano",travel,1,This comprehensive guide to Europe covers 43 countries and assists travelers with effortless planning through easy-to-use language sections and more budget focus than ever before. of color. 174 maps.
Lonely Planet San Francisco (Lonely Planet Pocket Guide San Francisco),Tom Given,history,1,"San Francisco's restaurants, shops and cultural offerings enjoy detailed coverage, as do tempting destinations outside the city, to Yosimite and Carmel. This guidebook embraces the vibrancy of the city."
Lonely Planet USA,"Jeff Campbell, Loretta Chilcoat, Susan Derby, Beth Greenfield, Carolyn B. Heller, Sam Martin, Debra Miller, Bob Morris, Becky Ohlsen, Andrea Schulte-Peevers, Kurt Wolff, Karla Zimmerman",travel,1,"This Lonely Planet guide covers all 50 U.S. states. It is packed with pre-trip planning advice, itinerary suggestions, distance charts and tips on the most interesting way of getting from A to B."
Lonely Planet Vietnam,"Nick Ray, Wendy Yanagihara",travel,1,"The Lonely Planet Country Guides are the complete country guides for independent travellers. They feature inspirational colour highlights sections, easy-to-use grid-referenced maps and insightful history, culture, food and environment chapters by specialised contributors."
Losing Hope: A Novel,Colleen Hoover,"romance, fiction",1,"Sometimes in life, in order to move forward you must face the past…#1 New York Times bestselling author Colleen Hoover held readers spellbound with her novel Hopeless, the story of what happened when a troubled girl named Sky encountered a long-lost childhood friend, Dean Holder. With Holder’s help, Sky uncovered shocking family secrets and came to terms with memories and emotions..."
Lost Art of the Great Speech: How to Write One--How to Deliver It,Richard Dowis,"self-help, business",1,"""Splashy slides, confident body language, and a lot of eye contact are fine and well. But if a speech is rambling, illogical, or just plain boring, the impact will be lost. Now everyone can learn to give powerful, on-target speeches that capture an audience's attention and drive home a message. The key is not just in the delivery techniques, but in tapping into the power of language...."
Love Hypothesis,Ali Hazelwood,fiction,1,Includes an excerpt from Love on the brain.
"Love Your Life, Not Theirs: 7 Money Habits for Living the Life You Want",Rachel Cruze,"finance, stock market",1,"In Love Your Life, Not Theirs, Rachel Cruze shines a spotlight on the most damaging money habit we have: comparing ourselves to others. Then she unpacks seven essential money habits for living the life we really want--a life in line with our values, where we can afford the things we want to buy without being buried under debt, stress, and worry.The Joneses are broke. Life looks good, but hidden..."
Lunch with the FT,Barber Lionel,biography,1,From film stars to politicians tycoons to writers dissidents to lifestyle gurus Lunch with the FT is a selection of classic interviews conducted in the unforgiving proximity of a restaurant table The list of people who have had Lunch with the FT since 1994 reads like an international Whos Who of our times Meet the rich and famous the weird and the brilliant the brave and the virtuous brought to...
"Maggie, a Girl of the Streets and Other New York Writings (Modern Library Classics)",Stephen Crane,fiction,1,"This harrowing tale of a young girl in the slums is a searing portrayal of turn-of-the-century New York, and Stephen Crane's most innovative work. Published in 1893, when the author was just twenty-one, it broke new ground with its vivid characters, its brutal naturalism, and its empathic rendering of the lives of the poor. It remains both powerful, severe, and harshly comic (in Alfred Kazin..."
"Making Your Voice Heard: How to own your space, access your inner power and become influential",DR. Connson Chou Locke,"communication, personal growth",1,"Making Your Voice Heard is a fresh take on how to successfully influence others, regardless of your gender or background.

DRAWING ON THE LATEST RESEARCH IN SOCIAL PSYCHOLOGY, DR. CONNSON CHOU LOCKE WILL LOOK AT WHY WE ARE PRONE TO MISCOMMUNICATE AND HOW TO OVERCOME THESE BARRIERS. 

This practical guide, based on her popular Guardian Masterclass, will help you hone your personal style, and..."
Man Called Ove: A Novel,Fredrik Backman,"fiction, novel, coming of age, family",1,"In this bestselling and “charming debut” (People) from one of Sweden’s most successful authors, a grumpy yet loveable man finds his solitary world turned on its head when a boisterous young family moves in next door.Meet Ove. He’s a curmudgeon—the kind of man who points at people he dislikes as if they were burglars caught outside his bedroom window. He has staunch..."
Mandarin: Lonely Planet Phrasebook,Unavailable,travel,1,"Containing essential words and phrases for effective communication with local people, this title is organized to help travellers find the right words at the right time with ease"
Marvel Comics Library. Spider-Man. Vol. 2. 1965-1966,Philippines,"comics, fiction, graphic novel",1,"Their collaboration on Spider-Man couldn't last forever-but the five-years of Stan Lee and Steve Ditko's remarkable partnership lasted long enough for their character to evolve into a timeless icon and create a fandom that would last generations. TASCHEN's second volume of Amazing Spider-Man stories collects the latter half of the duo's magnum opus, featuring brand new arch-villains the Scorpion,..."
Mary Shelley,Man Called Ove: A Novel,"biography, kids",1,"New in the critically acclaimed Little People, BIG DREAMS series, discover the incredible life of Mary Shelley, the English novelist and creator of Frankenstein. When Mary Shelley was a little girl, she used to write stories beneath the trees in her garden. As an adult, Mary was inspired by this same imagination to create a ghost story, which became the famous novel: Frankenstein. This gripping..."
Master Your Emotions,Fredrik Backman,self-help,6,"Think Smarter, Create Better Strategies, and Get Results Beyond Your Expectations.  Does reality fail to meet your expectations? Do you fall short of your goals over and over again? Do you feel overwhelmed, unsure what the best course of action to follow next?  If so, Master Your Thinking is for you Author and coach, Thibaut Meurisse, wants you to think smarter so that you can take better..."
Master Your Thinking,Thibaut Meurisse,self-help,2,"Think Smarter, Create Better Strategies, and Get Results Beyond Your Expectations.  Does reality fail to meet your expectations? Do you fall short of your goals over and over again? Do you feel overwhelmed, unsure what the best course of action to follow next?  If so, Master Your Thinking is for you Author and coach, Thibaut Meurisse, wants you to think smarter so that you can take better..."
Maybe Not,Colleen Hoover,"novel, romance, fiction, coming-of-age",1,"Colleen Hoover, the New York Times bestselling author of Maybe Someday, brilliantly brings to life the story of the hilarious and charismatic Warren in this new novella.When Warren has the opportunity to live with a female roommate, he instantly agrees. It could be an exciting change. Or maybe not. Especially when that roommate is the cold and seemingly calculating Bridgette. Tensions run high and..."
MAYBE NOW,Colleen Hoover,"fiction, romance",1,"Maggie meets Jake, a cardiologist with a penchant for tandem skydiving. Getting ready for a post-jump date, Maggie comes across an old list of things she wanted to do ""maybe one of these days,"" and decides what better time than now? She keeps Ridge updated on her adventures, but he can't help but worry, even as Sydney grows more and more suspicious about their friendship"
Maybe Someday,Colleen Hoover,"fiction, romance",1,"From #1 New York Times bestselling author Colleen Hoover, a passionate tale of friendship, betrayal, and romance.At twenty-two years old, Sydney has a great life: She’s in college, working a steady job, in love with her wonderful boyfriend, Hunter, and rooming with her best friend, Tori. But everything changes when she discovers Hunter's cheating on her—and she is left trying to..."
McDonaldization of Society: Into the Digital Age,George Ritzer,"sociology, guidebook",1,"The book that made ""McDonaldization"" part of the lexicon of contemporary sociological theory, read by hundreds of thousands of students, is now in its Ninth Edition! George Ritzer′s seminal work of critical sociology, The McDonaldization of Society, continues to stand as one of the pillars of modern day sociological thought. Building on the argument that that the fast food restaurant has become..."
Meditations,"Marcus Aurelius, George Long (Translator), Carolyn Gregoire (Foreword by)","self-help, business",1,"All twelve books by Roman Emperor Marcus Aurelius - his personal guidelines to live and rule well. ""Do every deed, speak every word, think every thought in the knowledge that you may end your days any moment."" ""We have body, soul, and intelligence. To the body belong the senses, to the soul the passions, to the intelligence principles."" ""Think not as your insulter judges or wishes you to judge:..."
Memoirs of Sherlock Holmes,A. Conan Doyle,fiction,1,"HarperCollins is proud to present its incredible range of best-loved, essential classics. âe~It is with a heavy heart that I take up my pen to write these the last words in which I shall ever record the singular gifts by which my friend Mr. Sherlock Holmes was distinguished.âe(tm) This collection of eleven stories depict Holmes and Watson at their very best and solving some of their most..."
Midnight Sun,Stephenie Meyer,"novel, fiction, young adult, romance, fantasy",1,It's here! #1 bestselling author Stephenie Meyer makes a triumphant return to the world of Twilight with this highly-anticipated companion: the iconic love story of Bella and Edward told from the vampire's point of view.
Military Misfortunes: The Anatomy of Failure in War,Eliot A. Cohen,military,1,Why do competent armies fail?• Why did the American-led coalition in Iraq fail to wage a classic counter-insurgency campaign for so long after the fall of Baghdad? • Why was the sophisticated Israeli intelligence service so thoroughly surprised by the onslaught of combined Arab armies during the Yom Kippur War of 1973? • How did a dozen German U-boats manage to humiliate the U.S....
Million Worlds with You (Firebird),Claudia Gray,"fiction, romance",1,"The fate of the multiverse rests in Marguerite’s hands in the final installment of the Firebird trilogy by New York Times bestselling author Claudia Gray.Ever since she used the Firebird, her parent’s invention, to cross through alternate dimensions, Marguerite has been at the center of a cross-dimensional feud. Now she has learned that the evil Triad Corporation plans to destroy hundreds of..."
Mindset: The New Psychology of Success,Carol Dweck,"business, inspiration, self-help",2,"World-renowned Stanford University psychologist Carol Dweck, in decades of research on achievement and success, has discovered a truly groundbreaking idea–the power of our mindset.Dweck explains why it’s not just our abilities and talent that bring us success–but whether we approach them with a fixed or growth mindset. She makes clear why praising intelligence and ability doesn&..."
Minecraft Mobspotter's Encyclopedia,Mojang Ab,kids,2,
Misery: A Novel,Stephen King,"novel, horror, fiction, thriller, psychological",1,"The #1 national bestseller about a famous novelist held hostage by his “number one fan” and suffering a frightening case of writer’s block—that could prove fatal. One of “Stephen King’s best…genuinely scary” (USA TODAY).Paul Sheldon is a bestselling novelist who has finally met his number one fan. Her name is Annie Wilkes, and she is more than a rabid reader—she is Paul’s nurse..."
Moment Maker: You Can Live Your Life or It Will Live You,Carlos Enrique Whittaker,personal growth,2,"How to Make Every Moment of Every Day Count Every moment of every day, you have a choice to make. You can either let the minutes pass you by or you can claim them for what they are: opportunities to unlock the full depth of life’s potential. For Carlos Whittaker, renowned blogger, musician and worship leader, and husband and dad, living deliberately is a way of life. Making moments that are..."
Monk Who Sold His Ferrari: A Fable About Fulfilling Your Dreams & Reaching Your Destiny,Robin S. Sharma,"self-help, personal growth",2,"This is an interesting story. It is a story of a lawyer who appears to have it all - the corner office, the life style, the cars, women, ... Then he gives it all up and tours the East. While there he comes across this strange monk and monastery. He comes to live life in a much different way. Yet he is challenged by the monk who has trained him to go back home and share the message he has learnt,..."
Monsters And Magic - NLP Coaching and Couseling Stories,"Emmanuel F. Silan, PHD","self-help, business",5,
"Multipliers, Revised and Updated: How the Best Leaders Make Everyone Smart",Liz Wiseman,"self-help, business",1,"A revised and updated edition of the acclaimed Wall Street Journal bestseller that explores why some leaders drain capability and intelligence from their teams while others amplify it to produce better results.We’ve all had experience with two dramatically different types of leaders. The first type drains intelligence, energy, and capability from the people around them and always needs to be the..."
"Mythology: Timeless Tales of Gods and Heroes, 75th Anniversary Illustrated Edition",Edith Hamilton,"mythology, history",2,"In celebration of of the 75th anniversary of this classic bestseller, this stunningly illustrated, beautifully packaged, larger-format hardcover edition will be beloved by fans of Greek, Roman, and Norse mythology of all ages. Since its original publication by Little, Brown and Company in 1942, Edith Hamilton's Mythology has sold millions of copies throughout the word and established itself as a..."
